{
 "schema": 1,
 "id": "c",
 "title": "C. Kitchen Drums",
 "mood": "A household in an earthquake: modelled pots, pans, wood, an oil drum and a lid, bowed glass, and a hummed tune. Modelled, not recorded: the real version is Orb's kitchen.",
 "rate": 13000,
 "transpose": -12,
 "drive": 1.1,
 "kit": {
  "lead": "hum",
  "bass": "oildrum",
  "bed": "glass",
  "chord": "pot",
  "arp": "pot",
  "bell": "pan",
  "kick": "oildrum",
  "snare": "wood",
  "tick": "spoon",
  "edge": "oildrum",
  "accent": "lid",
  "peak_extra": ""
 },
 "gain": {
  "drone": 0.3,
  "bass": 0.8,
  "chord": 0.8,
  "bed": 0.4,
  "bell": 0.5,
  "kick": 0.9,
  "snare": 0.8,
  "arp": 0.8,
  "tick": 0.5,
  "edge": 0.6,
  "accent": 0.7,
  "lead": 1.2,
  "peak_extra": 0.0
 },
 "patterns": {
  "bed": true,
  "bass_beats": [
   0,
   2.5
  ],
  "bass_len": 0.5,
  "bass_style": "sparse",
  "kick_beats": [
   0,
   2
  ],
  "kick_beats_half": [
   0
  ],
  "snare_beats": [
   1,
   3
  ],
  "chord_stabs": false,
  "tick_peak": 8,
  "peak_extra": ""
 }
}
